[
  {
    "cat": "al",
    "name": "Arco corto",
    "stats": [
      [
        "Habilidad",
        "Arm. ligero"
      ],
      [
        "Daño",
        "1d6 laceración"
      ],
      [
        "Alcance",
        "A distancia [24/96]"
      ],
      [
        "Rasgos",
        "A dos manos"
      ],
      [
        "Experto",
        "Preparación rápida"
      ],
      [
        "Peso/Precio",
        "1 kg · 80 mc"
      ]
    ],
    "mec": null,
    "note": null,
    "mej": null,
    "inc": null
  },
  {
    "cat": "al",
    "name": "Bastón",
    "stats": [
      [
        "Habilidad",
        "Arm. ligero"
      ],
      [
        "Daño",
        "1d6 golpe"
      ],
      [
        "Alcance",
        "Cuerpo a cuerpo"
      ],
      [
        "Rasgos",
        "Discreta, A dos manos"
      ],
      [
        "Experto",
        "Defensiva"
      ],
      [
        "Peso/Precio",
        "2 kg · 1 mc"
      ]
    ],
    "mec": null,
    "note": null,
    "mej": null,
    "inc": null
  },
  {
    "cat": "al",
    "name": "Cuchillo",
    "stats": [
      [
        "Habilidad",
        "Arm. ligero"
      ],
      [
        "Daño",
        "1d4 laceración"
      ],
      [
        "Alcance",
        "Cuerpo a cuerpo"
      ],
      [
        "Rasgos",
        "Discreta"
      ],
      [
        "Experto",
        "Mano secundaria, Arrojadiza [6/18]"
      ],
      [
        "Peso/Precio",
        "0,5 kg · 8 mc"
      ]
    ],
    "mec": null,
    "note": null,
    "mej": null,
    "inc": null
  },
  {
    "cat": "al",
    "name": "Espada lateral",
    "stats": [
      [
        "Habilidad",
        "Arm. ligero"
      ],
      [
        "Daño",
        "1d6 laceración"
      ],
      [
        "Alcance",
        "Cuerpo a cuerpo"
      ],
      [
        "Rasgos",
        "Preparación rápida"
      ],
      [
        "Experto",
        "Mano secundaria"
      ],
      [
        "Peso/Precio",
        "1 kg · 40 mc"
      ]
    ],
    "mec": null,
    "note": null,
    "mej": null,
    "inc": null
  },
  {
    "cat": "al",
    "name": "Espada ropera",
    "stats": [
      [
        "Habilidad",
        "Arm. ligero"
      ],
      [
        "Daño",
        "1d6 laceración"
      ],
      [
        "Alcance",
        "Cuerpo a cuerpo"
      ],
      [
        "Rasgos",
        "Preparación rápida"
      ],
      [
        "Experto",
        "Defensiva"
      ],
      [
        "Peso/Precio",
        "1 kg · 100 mc"
      ]
    ],
    "mec": null,
    "note": null,
    "mej": null,
    "inc": null
  },
  {
    "cat": "al",
    "name": "Honda",
    "stats": [
      [
        "Habilidad",
        "Arm. ligero"
      ],
      [
        "Daño",
        "1d4 golpe"
      ],
      [
        "Alcance",
        "A distancia [9/36]"
      ],
      [
        "Rasgos",
        "Discreta"
      ],
      [
        "Experto",
        "Indirecta"
      ],
      [
        "Peso/Precio",
        "0,5 kg · 2 mc"
      ]
    ],
    "mec": null,
    "note": null,
    "mej": null,
    "inc": null
  },
  {
    "cat": "al",
    "name": "Jabalina",
    "stats": [
      [
        "Habilidad",
        "Arm. ligero"
      ],
      [
        "Daño",
        "1d6 laceración"
      ],
      [
        "Alcance",
        "Cuerpo a cuerpo"
      ],
      [
        "Rasgos",
        "Arrojadiza [10/40]"
      ],
      [
        "Experto",
        "Indirecta"
      ],
      [
        "Peso/Precio",
        "1 kg · 20 mc"
      ]
    ],
    "mec": null,
    "note": null,
    "mej": null,
    "inc": null
  },
  {
    "cat": "al",
    "name": "Lanza corta",
    "stats": [
      [
        "Habilidad",
        "Arm. ligero"
      ],
      [
        "Daño",
        "1d8 laceración"
      ],
      [
        "Alcance",
        "Cuerpo a cuerpo"
      ],
      [
        "Rasgos",
        "A dos manos"
      ],
      [
        "Experto",
        "Única: pierde A dos manos"
      ],
      [
        "Peso/Precio",
        "1,5 kg · 10 mc"
      ]
    ],
    "mec": null,
    "note": null,
    "mej": null,
    "inc": null
  },
  {
    "cat": "al",
    "name": "Maza",
    "stats": [
      [
        "Habilidad",
        "Arm. ligero"
      ],
      [
        "Daño",
        "1d6 golpe"
      ],
      [
        "Alcance",
        "Cuerpo a cuerpo"
      ],
      [
        "Rasgos",
        "—"
      ],
      [
        "Experto",
        "Inercia"
      ],
      [
        "Peso/Precio",
        "1,5 kg · 20 mc"
      ]
    ],
    "mec": null,
    "note": null,
    "mej": null,
    "inc": null
  },
  {
    "cat": "ap",
    "name": "Alabarda",
    "stats": [
      [
        "Habilidad",
        "Arm. pesado"
      ],
      [
        "Daño",
        "1d10 laceración"
      ],
      [
        "Alcance",
        "Cuerpo a cuerpo"
      ],
      [
        "Rasgos",
        "A dos manos"
      ],
      [
        "Experto",
        "Única: alcance +1,5 m"
      ],
      [
        "Peso/Precio",
        "2,5 kg · 40 mc"
      ]
    ],
    "mec": null,
    "note": null,
    "mej": null,
    "inc": null
  },
  {
    "cat": "ap",
    "name": "Arco largo",
    "stats": [
      [
        "Habilidad",
        "Arm. pesado"
      ],
      [
        "Daño",
        "1d6 laceración"
      ],
      [
        "Alcance",
        "A distancia [45/180]"
      ],
      [
        "Rasgos",
        "A dos manos"
      ],
      [
        "Experto",
        "Indirecta"
      ],
      [
        "Peso/Precio",
        "1,5 kg · 100 mc"
      ]
    ],
    "mec": null,
    "note": null,
    "mej": null,
    "inc": null
  },
  {
    "cat": "ap",
    "name": "Ballesta",
    "stats": [
      [
        "Habilidad",
        "Arm. pesado"
      ],
      [
        "Daño",
        "1d8 laceración"
      ],
      [
        "Alcance",
        "A distancia [30/120]"
      ],
      [
        "Rasgos",
        "Cargada [1], A dos manos"
      ],
      [
        "Experto",
        "Mortífera"
      ],
      [
        "Peso/Precio",
        "3,5 kg · 200 mc"
      ]
    ],
    "mec": null,
    "note": null,
    "mej": null,
    "inc": null
  },
  {
    "cat": "ap",
    "name": "Escudo",
    "stats": [
      [
        "Habilidad",
        "Arm. pesado"
      ],
      [
        "Daño",
        "1d4 golpe"
      ],
      [
        "Alcance",
        "Cuerpo a cuerpo"
      ],
      [
        "Rasgos",
        "Defensiva"
      ],
      [
        "Experto",
        "Mano secundaria"
      ],
      [
        "Peso/Precio",
        "1 kg · 10 mc"
      ]
    ],
    "mec": null,
    "note": null,
    "mej": null,
    "inc": null
  },
  {
    "cat": "ap",
    "name": "Espada larga",
    "stats": [
      [
        "Habilidad",
        "Arm. pesado"
      ],
      [
        "Daño",
        "1d8 laceración"
      ],
      [
        "Alcance",
        "Cuerpo a cuerpo"
      ],
      [
        "Rasgos",
        "Preparación rápida, A dos manos"
      ],
      [
        "Experto",
        "Única: pierde A dos manos"
      ],
      [
        "Peso/Precio",
        "1,5 kg · 60 mc"
      ]
    ],
    "mec": null,
    "note": null,
    "mej": null,
    "inc": null
  },
  {
    "cat": "ap",
    "name": "Hacha",
    "stats": [
      [
        "Habilidad",
        "Arm. pesado"
      ],
      [
        "Daño",
        "1d6 laceración"
      ],
      [
        "Alcance",
        "Cuerpo a cuerpo"
      ],
      [
        "Rasgos",
        "Arrojadiza [6/18]"
      ],
      [
        "Experto",
        "Mano secundaria"
      ],
      [
        "Peso/Precio",
        "1 kg · 20 mc"
      ]
    ],
    "mec": null,
    "note": null,
    "mej": null,
    "inc": null
  },
  {
    "cat": "ap",
    "name": "Lanza larga",
    "stats": [
      [
        "Habilidad",
        "Arm. pesado"
      ],
      [
        "Daño",
        "1d8 laceración"
      ],
      [
        "Alcance",
        "Cuerpo a cuerpo [+1,5]"
      ],
      [
        "Rasgos",
        "A dos manos"
      ],
      [
        "Experto",
        "Defensiva"
      ],
      [
        "Peso/Precio",
        "4,5 kg · 15 mc"
      ]
    ],
    "mec": null,
    "note": null,
    "mej": null,
    "inc": null
  },
  {
    "cat": "ap",
    "name": "Mandoble",
    "stats": [
      [
        "Habilidad",
        "Arm. pesado"
      ],
      [
        "Daño",
        "1d10 laceración"
      ],
      [
        "Alcance",
        "Cuerpo a cuerpo"
      ],
      [
        "Rasgos",
        "A dos manos"
      ],
      [
        "Experto",
        "Mortífera"
      ],
      [
        "Peso/Precio",
        "3,5 kg · 200 mc"
      ]
    ],
    "mec": null,
    "note": null,
    "mej": null,
    "inc": null
  },
  {
    "cat": "ap",
    "name": "Martillo",
    "stats": [
      [
        "Habilidad",
        "Arm. pesado"
      ],
      [
        "Daño",
        "1d10 golpe"
      ],
      [
        "Alcance",
        "Cuerpo a cuerpo"
      ],
      [
        "Rasgos",
        "A dos manos"
      ],
      [
        "Experto",
        "Inercia"
      ],
      [
        "Peso/Precio",
        "4 kg · 40 mc"
      ]
    ],
    "mec": null,
    "note": null,
    "mej": null,
    "inc": null
  },
  {
    "cat": "ae",
    "name": "Ataque sin armas",
    "stats": [
      [
        "Habilidad",
        "Atletismo"
      ],
      [
        "Daño",
        "Única"
      ],
      [
        "Alcance",
        "Cuerpo a cuerpo"
      ],
      [
        "Rasgos",
        "Única"
      ],
      [
        "Experto",
        "Inercia, Mano secundaria"
      ],
      [
        "Peso/Precio",
        "No pesa · —"
      ]
    ],
    "mec": "Rasguño: 1 de daño por golpe. Impacto: 1 + mod. Fuerza. Pericia: puedes elegir Ataque sin armas como pericia en arma.",
    "note": null,
    "mej": null,
    "inc": null
  },
  {
    "cat": "ae",
    "name": "Arma improvisada",
    "stats": [
      [
        "Habilidad",
        "Como arma similar"
      ],
      [
        "Daño",
        "Como arma similar"
      ],
      [
        "Alcance",
        "Cuerpo a cuerpo"
      ],
      [
        "Rasgos",